Full Name,Profile URL,Headline,Comment,Timestamp,Comment URN,url
Krishan Anand,https://www.linkedin.com/in/krishan-anand-2403878a,Curating India’s Most Exclusive Experiences ⛷ | Founder @ Secret Ski Party | Building Experiential IPs in the Himalayas | Hotelier | Entrepreneur | Redefining the Future of Luxury,"Rishabh Mariwala Couldn’t agree more.

When I built The  Secret Ski Party, we had top-tier partners and guests but the real deal was how we stretched every rupee without compromising experience. High burn often masks indecision, entitlement, or blind optimism.

On the flip side, constraint breeds creativity and builds a culture that doesn’t panic when the runway shortens. Capital can’t save a team that confuses spend with strategy.",2025-08-25T08:06:07.959Z,"urn:li:comment:(activity:7365593808094347264,7365655707603431425)",
Isha Ostwal,https://www.linkedin.com/in/isha-ostwal-2112641a9,"Founder & Chief Everything Officer at DreamSVin - your partners in Growth & Execution | National Convenor JIIF | Global Shaper - World Economic Forum | Mentor at BEVISIONEERS,Mercedes-Benz Fellowship | Start-up Advisor","Exactly - burn shows mindset, not just math. Capital multiplies culture, it doesn’t replace it.",2025-08-25T07:52:50.280Z,"urn:li:comment:(activity:7365593808094347264,7365652361895100417)",
Pratik Mukasdar,https://www.linkedin.com/in/pratikmukasdar,Founder at RNL Investment Partners | Investment Portfolio Manager | Risk & Asset Allocation | Co-chair Young Indians Nagpur,"Frugality isn’t just about saving money, it often reflects focus, alignment, and long-term thinking.",2025-08-25T07:27:55.540Z,"urn:li:comment:(activity:7365593808094347264,7365646092505448448)",
Nikhil Kalwani,https://www.linkedin.com/in/nikhil-kalwani,Co-Founder and CFO at LUZO | Backed by 100X.VC and Enrission India Capital | Entrepreneur | Changing the way the beauty and wellness industry operates,"True Rishabh Mariwala, 
Unfortunately, not many VCs approach startups with this mentality in today's ecosystem. A business with 4X growth and -2% EBITDA is frequently viewed less favorably than one with 7X growth and -20% EBITDA, even at Series A stage.
Many founders who have raised money are now slowing down their growth trajectory because they are becoming pessimistic about the ecosystem. I hope more VCs start looking from this perspective",2025-08-25T06:30:07.760Z,"urn:li:comment:(activity:7365593808094347264,7365631547577704449)",
Dr. Shashikumar K.T,https://www.linkedin.com/in/tomato-breeder,Tomato Breeder & Senior Breeding Strategist | R&D Leadership | Innovation & Product Strategy | AI-Driven Prediction Breeding Models | Design & Systems Thinking | Process Excellence | Sustainable Agriculture,Companies evolve when they thoughtfully build discipline within teams — that’s the key to shaping culture,2025-08-25T06:27:01.709Z,"urn:li:comment:(activity:7365593808094347264,7365630767223230465)",
Atul Mehra,https://www.linkedin.com/in/atul-mehra-94475b8,Founder vaayushop.com| Enterprise AI | Forbes top 100 startup | Co-Founder All Bharat AI Association | Patent Pending,"There are more probs that money can't fix, especially at early stage. We experienced it by making mistakes...but glad - we didn't make fatal mistakes...",2025-08-25T06:15:43.349Z,"urn:li:comment:(activity:7365593808094347264,7365627921975193600)",
Chintamani Sardesai,https://www.linkedin.com/in/chintamani-sardesai,Co-Founder ElektrikExpress | Building MicroLogi™ The Future of Smart Mobility-as-a-Service | 0→3000+ EV Fleets | Redefining Urban Deliveries/CEO&Business Head Nexzu /TEDx speaker /Consulting & Mentoring startups,"Rishabh Mariwala Startups don’t have to burn cash. Many do to scale fast—spending on customer acquisition, product, and talent before revenues catch up. But if unit economics are strong or the model is bootstrapped/profitable (like Elektrikexpress,Zerodha, Zoho), growth can be sustainable without heavy burn. Burning is a choice for speed, not a necessity.",2025-08-25T05:55:28.233Z,"urn:li:comment:(activity:7365593808094347264,7365622825413394432)",
Farah Ismail,https://www.linkedin.com/in/farah-ismail,Executive Coach (ICF PCC) | Leadership Facilitator (IAF-CPF) | Certified B❒X Facilitator,"Growth without culture is fragile. 
These days, it’s about how people feel, how they’re treated, and whether they belong. For the better, leaders need to listen more and act with intention. Rishabh Mariwala",2025-08-25T05:32:15.914Z,"urn:li:comment:(activity:7365593808094347264,7365616985600110592)",
Avigyan Mitra,https://www.linkedin.com/in/avigyanmitraofficial,Helping families afford healthcare | 100+ families helped | Built 20K+ community on LinkedIn & Reddit,"Totally agree. According to a CB Insights study, 29% of startups fail because they run out of cash, and many of them burn too fast before proving unit economics. A lean culture helps, but clarity of purpose matters more.",2025-08-25T05:27:43.066Z,"urn:li:comment:(activity:7365593808094347264,7365615841192652801)",
Rakesh Sharma,https://www.linkedin.com/in/rakesh-sharma-succession,India's #1 Succession Guru for Family Businesses | Author | Family Business Mentor | Board Member on FB | Seasoned IyengarYoga practitioner | FCA | 10000+ Family Business Owners Impacted | 27+ Years Experience,"Startups that learn to do more with less often build stronger foundations, because culture scales far more reliably than capital Rishabh Mariwala",2025-08-25T05:26:49.224Z,"urn:li:comment:(activity:7365593808094347264,7365615615362916353)",
Dr Chytra Anand,https://www.linkedin.com/in/drchytra,"Empowering Indians to look good, feel good @ Kosmoderma @ SkinQ Tedx speaker Executive committee @ Karnataka Medical Council Investor in Women’s Entrepreneurial Journey Board member @ NGO Cleft Palate ABMSS","Money scales a business, but culture scales empires; never underestimate the engine. Rishabh Mariwala",2025-08-25T05:25:03.289Z,"urn:li:comment:(activity:7365593808094347264,7365615171039358976)",
Subrata Dutta,https://www.linkedin.com/in/subrata-dutta1,Consulting| Strategy| Product Management| Architecture| GTM| Stakeholder Management| MVNE| IOT| Connected Car| Cybersecurity| 5G API Monetization| Roaming VAS| eSIM SGP.32| AI-ML| Automation| Regulatory| Ecosystem Play,"Your point about frugality becoming embedded in company culture resonates deeply. I'd add that the most sustainable startups I've observed practice ""intentional spending"" - they're not just frugal, but strategically selective about where they deploy capital for maximum impact.  ",2025-08-25T05:10:42.198Z,"urn:li:comment:(activity:7365593808094347264,7365611559366090752)",
Chintan Shah,https://www.linkedin.com/in/chintan-shah-837aa261,"Strategic Finance Leader | CA | EV & Startup Finance | Plant Controller | FP&A | Business Partnering | Manufacturing | Matter | Ex-Adani, Indus Towers, Reliance","Thanks for sharing — so much to learn! Converting numbers into culture is powerful, and frugality truly builds lasting impact beyond just scale.",2025-08-25T05:07:03.550Z,"urn:li:comment:(activity:7365593808094347264,7365610642281525249)",
"Pramod Solanki, Ph. D.",https://www.linkedin.com/in/drpramodsolanki-growthcatalyst,"Executive Coach I Catalyst for Growth - Enabling CXOs & Leadership Teams to Align, Lead & Deliver Breakthrough Results I Consulting CHRO I Ex-L&T, TCS, Sun Pharma, IIM A, JBIMS Mumbai I Founder – Performance Enablers",So aptly said Rishabh Mariwala,2025-08-25T04:51:58.411Z,"urn:li:comment:(activity:7365593808094347264,7365606845861756928)",
Parikshit Mimani,https://www.linkedin.com/in/parikshitmimani,F&B Bakery Retail sector | Creating Category identity exclusively for Cheesecakes | Growth Stage,"I cannot agree to you lesser.

Capital must only be seeked as a fuel not as a survival.
With the motive of making quick wealth, everystake holder puts the core fundamentals of performing business, on a toss.

Not only founders, VC's, fund houses, any funding source is equally responsible which has encouraged this culture in expectation of making quick wealth. They completely ignored on witnessing and assessing fundamentals of business for investing.

Rishabh, I am glad that I don't feel left out alone with my thoughts and appreciate the points you are bringing up.

Thanks a ton",2025-08-25T04:42:41.778Z,"urn:li:comment:(activity:7365593808094347264,7365604511173840896)",
Jayant Ghosh,https://www.linkedin.com/in/jayantghosh,"From Scaling Businesses to Leading Transformation | Sales, Growth, GTM & P&L Leadership | SaaS, AI/ML, IoT | CXO Partnerships | Building Future-Ready Businesses","A frugal mindset fosters resilience and innovation, which ultimately proves far more sustainable than merely relying on financial resources. Building a strong culture from the start truly lays the foundation for long-term success. ",2025-08-25T04:41:25.287Z,"urn:li:comment:(activity:7365593808094347264,7365604190347214848)",
Gaurav Saini,https://www.linkedin.com/in/gauravsaini03,Building Vizitor | Workplace Security & Visitor Experience,"Love this thought process … But somehow this was not how VCs used to think 2 years back. 

Its great to see how our ecosystem is evolving :)",2025-08-25T04:36:15.124Z,"urn:li:comment:(activity:7365593808094347264,7365602889425227777)",
Piyush Rathi,https://www.linkedin.com/in/pcrathi,"Entrepreneur, Meditator, Investor",TRUE,2025-08-25T04:29:06.766Z,"urn:li:comment:(activity:7365593808094347264,7365601092765736960)",
sanjay kaul,https://www.linkedin.com/in/sanjay-kaul-3842b315,DIRECTOR at F E SECURITIES P LTD,True that,2025-08-25T04:20:58.941Z,"urn:li:comment:(activity:7365593808094347264,7365599046675202048)",
Rakesh Gaikwad,https://www.linkedin.com/in/rakesh-gaikwad-52b4b910,"Payroll Specialist | 25+ Years in Payroll Management - India, Dubai and Egypt, Statutory Compliance & HRIS | Expertise in SAP Accounting, PF, Gratuity, Superannuation | HR Operations Across FMCG, BFSI & Manufacturing",TRUE,2025-08-25T04:20:00.778Z,"urn:li:comment:(activity:7365593808094347264,7365598802721800192)",
