Full Name,Profile URL,Headline,Comment,Timestamp,Comment URN,url,processed_comment,sentiment_negative,sentiment_neutral,sentiment_positive,sentiment_compound,sentiment_label
deepak ..,https://www.linkedin.com/in/deepak-b6a0b9b3,Assistant Divisional Manager at LIC OF INDIA,Well done!,2025-07-24T01:05:05.773Z,"urn:li:comment:(ugcPost:7352915059913691136,7353953338616332288)",https://www.linkedin.com/posts/rishabhmariwala_india-startups-motivation-activity-7352915060576387072-ye_k?utm_source=social_share_send&utm_medium=member_desktop_web&rcm=ACoAAGCcrnQBrKbSa0WbTmL6WkyFlIEj-GhhK0I,well done,0.0,0.323,0.677,0.2732,Positive
Divya Lohiya,https://www.linkedin.com/in/divya-lohiya,Mindful CEO | Sustainable Luxury | Gourmet Dry Fruits | Mental Health in Business,This is such a refreshing shift from playbooks to presence. Founders often need less advice and more reflection. Grateful to see Sharrp creating space for just that.,2025-07-22T11:20:10.151Z,"urn:li:comment:(ugcPost:7352915059913691136,7353383351065440257)",,this is such a refreshing shift from playbooks to presence founders often need less advice and more reflection grateful to see sharrp creating space for just that,0.0,0.814,0.186,0.6682,Positive
Mukul Aggarwal,https://www.linkedin.com/in/aggarwal-mukul,IPO Architect | Capital Aggregation Expert | SME IPO | Wealth Growth Partner | NISM & RERA Certified | Designing Blueprints for Public Market Success,Love how our ecosystem blends ambition with resilience. That’s where real value creation begins. Rishabh Mariwala,2025-07-21T11:53:43.320Z,"urn:li:comment:(ugcPost:7352915059913691136,7353029407046881280)",,love how our ecosystem blends ambition with resilience thats where real value creation begins rishabh mariwala,0.0,0.599,0.401,0.8271,Positive
RAJESH MANJREKAR,https://www.linkedin.com/in/rajesh-manjrekar-17600530,Financial Modelling Consultant | International Finance Expert,Congrats Rishabh! 🎉,2025-07-21T07:36:05.779Z,"urn:li:comment:(ugcPost:7352915059913691136,7352964573416558593)",,congrats rishabh,0.0,0.227,0.773,0.5267,Positive
Jayant Ghosh,https://www.linkedin.com/in/jayantghosh,"From Scaling Businesses to Leading Transformation | Sales, Growth, GTM & P&L Leadership | SaaS, AI/ML, IoT | CXO Partnerships | Building Future-Ready Businesses",An environment where founders can share and learn from each other creates invaluable insights that can't be found in any guide. ,2025-07-21T06:12:05.386Z,"urn:li:comment:(ugcPost:7352915059913691136,7352943432476016640)",,an environment where founders can share and learn from each other creates invaluable insights that cant be found in any guide,0.0,0.815,0.185,0.5106,Positive
Talha K,https://www.linkedin.com/in/talha-khatkhatay,Food Safety & Quality Manager | 10+ Years Driving Safe & Compliant Food Operations | Empowering Teams through Leadership Coaching,"Rishabh Is this only for big founders or can someone just starting also join? I’d really love to be part of it… I want to share my failures and how I’m trying to bounce back!

talha.co.in",2025-07-21T04:44:49.308Z,"urn:li:comment:(ugcPost:7352915059913691136,7352921470773166080)",,rishabh is this only for big founders or can someone just starting also join id really love to be part of it i want to share my failures and how im trying to bounce back talhacoin,0.069,0.695,0.236,0.7346,Positive
