Kajal,V.,Kajal V.,https://www.linkedin.com/in/kajalvishwa,Co-founder WedidX | Founder @ 21GenX | Empowering D2C Brands in India | Next Gen E-commerce Marketplace | Angel Investor,comment,"Global playbooks inspire, but the winners are those who truly understand India’s nuances.",2025-09-08T05:39:56.777Z,No,"urn:li:comment:(activity:7370662136953442304,7370692348718256128)",0,No,No,
HEMANSHU,"BAHETY CA , CPA(US)","HEMANSHU BAHETY CA , CPA(US)",https://www.linkedin.com/in/hemanshu-bahety-ca-cpa-us-b0349967,"Founder at Axe My Tax | NRI Tax Solutions, Audits",comment,Trying to fit a global solution into India’s diverse landscape often misses the mark because it overlooks the rich complexity that defines this market. The founders who truly win are those who embrace local nuances and tailor their approach to real behaviors and preferences. Success isn’t about copying; it’s about understanding what makes this market uniquely challenging and rewarding.,2025-09-08T05:38:35.892Z,No,"urn:li:comment:(activity:7370662136953442304,7370692009461772288)",0,No,No,
Ashutosh,Gavali,Ashutosh Gavali,https://www.linkedin.com/in/ashutoshgavali,"Chief Digital Officer | Driving Growth Across D2C, Real Estate, and Sports | Digital Strategy | Data Platforms | AI & Automation | Cybersecurity",comment,"India's market mosaic demands a ""desi-first"" lens. Think how UPI revolutionized payments by addressing trust and accessibility in ways no Western model could replicate. Founders who dive into those cultural undercurrents not only build resilient businesses but also unlock massive scale. 
Woulf love to know what's one Indian nuance you have seen make or break a startup pitch?",2025-09-08T05:30:07.353Z,No,"urn:li:comment:(activity:7370662136953442304,7370689876494708737)",1,No,No,
Amit,Kumar,Amit Kumar,https://www.linkedin.com/in/altruisticamitt,Founder @ Nearz | Scaling 250+ Salons with Tech | Ex-McKinsey | Ex-Amazon Trainer | AI & Growth Strategist | Sharing Startup Lessons,comment,"So true 👏 India isn’t a copy-paste market, it’s a mosaic. What works in California might flop in Kanpur. The real winners are founders who decode local habits + trust gaps + cultural nuance and build around them. 🌏➡🇮🇳",2025-09-08T05:25:33.120Z,No,"urn:li:comment:(activity:7370662136953442304,7370688726278029312)",0,No,No,
Sathish,BV,Sathish BV,https://www.linkedin.com/in/sathishbv,Filter Coffeepreneur | Democratizing Authentic Indian Filter Coffee in North India | Building B2B & Creating Micro-Entrepreneurs | No Preservatives | Scalable Coffee Model,comment,"Rishabh Mariwala, Exactly,  #FilterCoffee thrives on local taste, not global copycats.",2025-09-08T05:24:19.361Z,No,"urn:li:comment:(activity:7370662136953442304,7370688416910356480)",0,No,No,
Chandni,Gupta,Chandni Gupta,https://www.linkedin.com/in/chandniguptabullzeye,Founder- Recruitment Expert @ Bullzeye Consulting | Co-Founder Aurum crafts| || Experts in Leadership & Diversity Hiring,comment,"Global examples can inspire, but India’s diversity demands its own playbook, built ground-up, not imported.",2025-09-08T05:13:23.498Z,No,"urn:li:comment:(activity:7370662136953442304,7370685666025906176)",0,No,No,
Shiv,Kumar Pandey,Shiv Kumar Pandey,https://www.linkedin.com/in/shivpandey,"HR Services Marketing Expert | Founder & CEO, Niumatrix Digital",comment,"Absolutely — the real edge lies in tailoring solutions to India’s unique diversity, not copy-pasting global models.",2025-09-08T05:08:26.378Z,No,"urn:li:comment:(activity:7370662136953442304,7370684419814322176)",0,No,No,
Vivek,Singh,Vivek Singh,https://www.linkedin.com/in/viveksinghhexo,Charting Your Financial Future | Speaker on Wealth Beyond Finance | AMFI Registered Mutual Fund Distributor,comment,"What works here is not scale-first but trust-first, because habits, wallets, and even aspirations differ lane by lane. Copy-paste rarely survives nuance.",2025-09-08T05:05:38.856Z,No,"urn:li:comment:(activity:7370662136953442304,7370683717171834880)",0,No,No,
Swapnil,Arjariya,Swapnil Arjariya,https://www.linkedin.com/in/swapnil-arjariya-23086085,Maritime Technical Leader | Decarbonization & Sustainable Shipping | IoT & Solar & Ai Advisor l UK US Cyprus India,comment,"Mr. Rishabh Mariwala couldn't be any simple example for young startups, India is with diversed culture and !! customers !!",2025-09-08T04:48:46.334Z,No,"urn:li:comment:(activity:7370662136953442304,7370679470346805249)",0,No,No,
Jayant,Ghosh,Jayant Ghosh,https://www.linkedin.com/in/jayantghosh,"From Scaling Businesses to Leading Transformation | Sales, Growth, GTM & P&L Leadership | SaaS, AI/ML, IoT | CXO Partnerships | Building Future-Ready Businesses",comment,"Rishabh, you're absolutely right. Understanding the diverse socio-economic and cultural landscape of India is crucial for building successful ventures.  Adapt strategies that resonate with local nuances rather than merely replicating global models. Crafting solutions tailored to Indian consumers' unique behaviours can unlock immense potential.",2025-09-08T04:43:42.688Z,No,"urn:li:comment:(activity:7370662136953442304,7370678196763181058)",0,No,No,
Anirudh,Syal,Anirudh Syal,https://www.linkedin.com/in/anirudhsyal,Product Strategy and Client engagement Leader | Building Data-Driven Solutions for Scaling Businesses,comment,"You are not getting it right. This is another level of speculation. Speculations dont work. How so ever nuanced it be. 
If you really want to judge a business, talk to its customers. If the business does not have customers yet, Dont event think of investing unless you are an oracle. Keep it simple. Rest is Noise. ",2025-09-08T04:33:01.780Z,No,"urn:li:comment:(activity:7370662136953442304,7370675508600238080)",0,No,No,
Praveen,K C Reddy,Praveen K C Reddy,https://www.linkedin.com/in/praveen-k-c-reddy-1214a2a8,Founder @ KnowConnections (KC) | Building an AI-powered & gamified networking assistant | From cards to intelligent connections | 500+ users & growing,comment,"So true—India isn’t just a market, it’s a mosaic. What works in Mumbai might fail in Indore, and what wins in Delhi might flop in Kochi. Founders who design for these nuances don’t just build companies, they build movements.",2025-09-08T04:31:05.242Z,No,"urn:li:comment:(activity:7370662136953442304,7370675019804442624)",0,No,No,
Divya,Lohiya,Divya Lohiya,https://www.linkedin.com/in/divya-lohiya,Mindful CEO | Sustainable Luxury | Gourmet Dry Fruits | Mental Health in Business,comment,"The real edge isn’t in copy-pasting global playbooks but decoding India’s unique complexity, regional, cultural, and behavioural. 

The founders who win here are the ones who design with India, not just for India.",2025-09-08T04:29:29.626Z,No,"urn:li:comment:(activity:7370662136953442304,7370674618766032896)",0,No,No,
Neha,Chawla,Neha Chawla,https://www.linkedin.com/in/entrepreneur-nehachawla,Coach for Your First ₹100 Crores ($12M) and Beyond | Business Mindset Coach | Business Mentor | 10X Wealth Creation for Entrepreneurs | Founder@ Mind Your Mindsbusiness | Book a 1:1 Call Today!,comment,"India is different dynamics every state you go to and within states every city is different as an entrepreneur we need to understand this while pitching to investors .

 Rishabh Mariwala",2025-09-08T04:15:36.267Z,No,"urn:li:comment:(activity:7370662136953442304,7370671123400667136)",0,No,No,
Mukul,Ronak Das,Mukul Ronak Das,https://www.linkedin.com/in/mukulronakdas,Bringing Skies Indoors for Indians | Making the dream of Human flight a Reality with iFLY Bharat @ Waltair Group | Advisor & Sales Strategist for Flex Industry & CRE | Helping to build Automated Sales Engines with AI 🤖,comment,"India isn’t one market, it’s a hundred micro-markets stitched together. What sells in Indiranagar won’t move in Indore. Rishabh Mariwala",2025-09-08T03:58:12.690Z,No,"urn:li:comment:(activity:7370662136953442304,7370666746321502208)",0,No,No,
Sumeet,Seraf,Sumeet Seraf,https://www.linkedin.com/in/sumeetseraf,Investment Banking for Founders | $650M+ Raised | Private Equity | M&A | Fundraising Advisor | Founder @ Equity360,comment,"Brilliantly put Rishabh Mariwala. I’ve met so many founders who walk into the room armed with global playbooks—yet India humbles them quickly.
Here, distribution looks like kirana trust, payments flow through family dynamics, and even packaging has to align with regional rituals. One India is really many Indias.
Copying global models may give a head start, but building for Indian nuance is what creates endurance. That’s where the true alpha lies.",2025-09-08T03:45:25.071Z,No,"urn:li:comment:(activity:7370662136953442304,7370663526698381312)",0,No,No,
